{
  "$schema": "https://json-schema.org/draft/2020-12/schema",
  "title": "Octoplanner Rule",
  "type": "object",
  "additionalProperties": false,
  "required": ["id", "type", "target"],
  "properties": {
    "id": { "type": "string", "minLength": 1 },
    "type": {
      "enum": [
        "not-start-until",
        "not-finish-after",
        "resource-unavailable",
        "lock-operation",
        "lock-requirement",
        "avoid-resource",
        "prefer-resource",
        "priority-boost",
        "must-run-before",
        "must-run-after",
        "supply-not-available-until"
      ]
    },
    "target": { "$ref": "#/$defs/target" },
    "enabled": { "type": "boolean", "default": true },
    "reason": { "type": "string", "minLength": 1 },
    "until": { "type": "string", "format": "date-time" },
    "after": { "type": "string", "format": "date-time" },
    "from": { "type": "string", "format": "date-time" },
    "to": { "type": "string", "format": "date-time" },
    "priority": { "type": "number" },
    "resourceId": { "type": "string", "minLength": 1 },
    "relatedTarget": { "$ref": "#/$defs/target" },
    "expiresAt": { "type": "string", "format": "date-time" },
    "createdAt": { "type": "string", "format": "date-time" }
  },
  "$defs": {
    "target": {
      "type": "object",
      "additionalProperties": false,
      "required": ["kind", "id"],
      "properties": {
        "kind": { "enum": ["requirement", "item", "operation", "resource", "supply"] },
        "id": { "type": "string", "minLength": 1 }
      }
    }
  }
}
