[
  {
    "id": "RULE-MC-02-DOWN",
    "type": "resource-unavailable",
    "target": {
      "kind": "resource",
      "id": "MC-02"
    },
    "from": "2026-04-06T08:00:00.000Z",
    "to": "2026-04-06T16:00:00.000Z",
    "reason": "Threading machine repair"
  },
  {
    "id": "RULE-REQ-RS-1-MATERIAL",
    "type": "not-start-until",
    "target": {
      "kind": "requirement",
      "id": "REQ-RS-1"
    },
    "until": "2026-04-07T08:00:00.000Z",
    "reason": "Material shortage"
  }
]
